{
  "class_name": "GeneratedCompatKitConformanceGameTests",
  "families": [
    {
      "batch": 8,
      "expected_deltas": {
        "catalyst_tool_remainder": {
          "item/ae2:logic_processor": 1,
          "item/minecraft:redstone": -1
        },
        "happy": {
          "item/ae2:logic_processor": 1,
          "item/minecraft:redstone": -1
        },
        "multi_output": {
          "item/ae2:logic_processor": 1,
          "item/ae2:silicon": 1,
          "item/minecraft:redstone": -1
        }
      },
      "id": "inscriber_recipe",
      "provider": {
        "factory_member": "create",
        "owner": "com.swear.autostorage.compatkitfixture.CompatKitConformanceProvider"
      },
      "sample_recipe_id": "ae2:logic_processor"
    }
  ],
  "game_test_namespace": "auto_storage_compat_kit_fixture",
  "kind": "auto_storage_compat_conformance_plan",
  "package": "com.swear.autostorage.compatkitfixture.generated",
  "schema": 1,
  "source_contract_digest": "846f86c211aec80ed9e740d5956a013173fa8b26785501cd027c6336e0db2aad",
  "target": {
    "display_name": "Applied Energistics 2",
    "mod_id": "ae2",
    "version": "19.2.17"
  }
}
